{
  "nivel": "L2",
  "productos": [
    "CMIP",
    "ACTP"
  ],
  "dominio": "conus",
  "creado_por": "vescudero@geografia.unam.mx",
  "fechas": {
    "20200101": [
      "19:19-22:19"
    ],
    "20200212": [
      "17:51-20:51",
      "19:31-22:31"
    ],
    "20201002": [
      "19:11-22:11"
    ],
    "20201006": [
      "06:46-09:46"
    ],
    "20240101": [
      "19:31-22:31"
    ],
    "20240103": [
      "17:59-20:59"
    ],
    "20240111": [
      "18:49-21:49"
    ],
    "20240117": [
      "06:36-09:36",
      "07:21-10:21",
      "17:46-20:46",
      "19:27-22:27"
    ],
    "20240203": [
      "07:56-22:56"
    ],
    "20240301": [
      "18:11-21:11"
    ],
    "20240306": [
      "19:01-22:01"
    ]
  }
}
